{
  "$schema": "https://json-schema.org/draft/2020-12/schema",
  "$id": "https://schemas.ardyn.ai/boundary-maps/ardyn.phase-5.19.approval-prerequisite-reader-hardening.schema.json",
  "title": "ARDYN Boundary Map: ardyn.phase-5.19.approval-prerequisite-reader-hardening",
  "description": "Auto-generated JSON Schema for boundary-map artifact validation. Enforces shape + safety invariants.",
  "type": "object",
  "required": [
    "schema",
    "schemaVersion",
    "phase",
    "artifactKind",
    "metadataGeneratedAt",
    "sourcePhase",
    "readerSummary",
    "readerInputShape",
    "readerResultShape",
    "readerCases",
    "evaluatorIntegration",
    "blockedRuntimeEffect",
    "serveRuntimeBlockedBehavior",
    "forbiddenBehavior",
    "filesAllowedToChange",
    "filesForbiddenToChange",
    "validationCommands"
  ],
  "properties": {
    "schema": {
      "type": "string",
      "const": "ardyn.phase-5.19.approval-prerequisite-reader-hardening"
    },
    "schemaVersion": {
      "type": "string"
    },
    "phase": {
      "type": "string"
    },
    "artifactKind": {
      "type": "string"
    },
    "metadataGeneratedAt": {
      "type": "string"
    },
    "sourcePhase": {
      "type": "object"
    },
    "readerSummary": {
      "type": "object"
    },
    "readerInputShape": {
      "type": "object"
    },
    "readerResultShape": {
      "type": "object"
    },
    "readerCases": {
      "type": "array"
    },
    "evaluatorIntegration": {
      "type": "object"
    },
    "blockedRuntimeEffect": {
      "type": "object"
    },
    "serveRuntimeBlockedBehavior": {
      "type": "object"
    },
    "forbiddenBehavior": {
      "type": "array"
    },
    "filesAllowedToChange": {
      "type": "array"
    },
    "filesForbiddenToChange": {
      "type": "array"
    },
    "validationCommands": {
      "type": "array"
    }
  },
  "additionalProperties": true
}
